Date / Time,City,State,Shape,Duration,Summary,Posted
4/30/2020 0:00,Thibodaux,LA,Light,5,"14 Objects in a row, one behind each other and watch one by one disappear. ((Starlink satellites?))",6/25/2020
4/30/2020 23:49,Saint Petersburg,FL,Other,7 minutes,There were three dots in a straight line slowly moving for a while then boom vanish!,6/25/2020
4/30/2020 22:43,Edgewood,WA,Unknown,15-20 seconds,"Location of sighting: Edgewood, WA Date: Thursday April 30th Time: 10:43 PM Weather conditions: clear and other stars visible On Thurs",6/25/2020
4/30/2020 22:30,Vergas,MN,Light,>2 hours,White moving light. ((NUFORC Note: Venus?? PD)),6/25/2020
4/30/2020 22:00,Jacksonville,FL,Light,5 minutes,"Looked like stars, could have been satellites, but 50? ((Starlink satellites?))",6/25/2020
4/30/2020 22:00,Tavares,FL,Formation,5 minutes,Fast moving formation of 20+ objects flying 2 abreast. ((Starlink satellites?)),6/25/2020
4/30/2020 22:00,Calgary (Canada),AB,Disk,<5 minutes,"At approximately 10:00pm, I spotted a large white light in the sky, it was very bright. I went outside to inspect it further and the li",6/25/2020
4/30/2020 22:00,Lincoln,AL,Other,10-15 minutes,Lights moving across the night sky. ((Starlink satellites?)),6/25/2020
4/30/2020 21:43,Miami,FL,Unknown,0:15,Hovering bright light,6/25/2020
4/30/2020 21:35,Montverde,FL,Unknown,5 Minutes,West to East was a straight line of what appeared to be air craft of some sort. ((Starlink satellites?)),6/25/2020
4/30/2020 21:30,Redmond,WA,Light,20 minutes,long string of moving lights. ((Starlink satellites?)),6/25/2020
4/30/2020 21:30,Davie,FL,Formation,3:00 Minutes,6 craft line formation over south Florida. ((Starlink satellites?)),6/25/2020
4/30/2020 21:30,Jacksonville,FL,Light,2 minutes,There were 10-20 Star-like figures gliding across the sky in unison. ((Starlink satellites?)),6/25/2020
4/30/2020 21:25,St. Cloud,FL,Formation,5 to 10 minutes,Just outside and looked at the sky and there was a line of UFOs about 15 to 20 objects. ((Starlink satellites?)),6/25/2020
4/30/2020 21:25,Jacksonville,FL,Unknown,2 minutes,Lights moving astronomically fast around the sky they stopped moving and stood still for about 15 seconds and then zoomed off,6/25/2020
4/30/2020 21:23,Tampa,FL,Circle,5 min maybe,Atleast 20 circular objects flying in a straight line at the same speed. ((Starlink satellites?)),6/25/2020
4/30/2020 21:20,Jupiter,FL,Formation,5 minutes,string of lights. ((Starlink satellites?)),6/25/2020
4/30/2020 21:20,Honolulu,HI,Unknown,1 minute,I was shootimg darts in my carport and saw a military helicopter flyer way faster than usual. As it get closer to land i niticed a wh,6/25/2020
4/30/2020 21:20,Deland,FL,Light,5 minutes,there was A-line of lights moving a cross the sky. They were moving North to South. ((Starlink satellites?)),6/25/2020
4/30/2020 21:15,Coconut Creek,FL,Formation,Less than a minute,Dots of light in a line formation slowly moved in a southwest upward motion and each disappeared as it looked to be going upward.,6/25/2020
4/30/2020 21:15,Brooksville,FL,Light,10,"Long string of 24+ equally spaced lights moving across the sky from North to South in Brooksville, FL.",6/25/2020
4/30/2020 21:15,New Smyrna Beach,FL,Light,20 seconds,Numerous lights flying across the sky in a straight line and equidistant. ((Starlink satellites?)),6/25/2020
4/30/2020 21:15,Coral Springs,FL,Light,3:00,It was a consistent line of moving lights evenly spaced. ((Starlink satellites?)),6/25/2020
4/30/2020 21:15,Fort Myers,FL,Rectangle,1 minute,"A line of line of lights 7 in front, 5 in the middle, and another 6 or 7 in front. ((Starlink satellites?))",6/25/2020
4/30/2020 21:10,Saint Augustine,FL,Light,5 minutes,20 plus lights in single file. About 5 minutes viewing. Last 2 lights were side by side. ((Starlink satellites?)),6/25/2020
4/30/2020 21:09,Des Moines,IA,Disk,2 minutes,hovering saucer nears ground then disappears in sky,6/25/2020
4/30/2020 21:05,Titusville,FL,Light,12 minutes,Objects look like stars but moving fast in one line. ((Starlink satellites?)),6/25/2020
4/30/2020 21:00,Coral Gables,FL,Light,5 min,A couple stopped me and told me &quot;Am I crazy or those lights are moving? ((Starlink satellites?)),6/25/2020
4/30/2020 21:00,Palm Bay,FL,Light,5 minutes,15 plus lights traveling in perfect straight line. Appeared as bright as a star.,6/25/2020
4/30/2020 21:00,Seabrook,TX,Formation,2 minutes,19 fast flying silent UFOs in formation. ((Starlink satellites?)),6/25/2020
4/30/2020 21:00,Ocala,FL,Light,Varied,I went out to smoke i always watch the sky when i seen 6 white lights high in the sky flying 2x2 with 1 in the front lasted for about 1,6/25/2020
4/30/2020 21:00,Dover,FL,Light,5 minutes,String of lights in Tampa Bay area.. ((Starlink satellites?)),6/25/2020
4/30/2020 20:50,Baton Rouge,LA,Formation,5 minutes,Line of light moving across the sky. ((Starlink satellites?)),6/25/2020
4/30/2020 20:15,Clermont,FL,Cigar,5 Minutes,I saw 20+ bright lights cross the sky to the West below the moon. ((Starlink satellites?)),6/25/2020
4/30/2020 20:10,Truth or Consequences,NM,Circle,10 seconds,Was visible to the north. Two large circular red lights. Moved from east to west. Both lights appeared and then they moved west one ov,6/25/2020
4/30/2020 19:50,Roseburg,OR,Oval,5 minutes,"We were driving and had to pull over, craft was moving slowly, was as white as light, we watched it zig zag slowly and then disappear o",6/25/2020
4/30/2020 19:00,Pleasant view,UT,Sphere,60 seconds,My girlfriend and I were hammocking in my back yard when we saw something we first thought was a weather ballon then changes shape into,6/25/2020
4/30/2020 17:00,Vancouver,WA,Circle,5 minutes,"Saw 'white orb swarm' of 10-20 during the day, near Columbia River in Vancouver, WA on 4/30/20.",6/25/2020
4/30/2020 17:00,Micco,FL,Light,5:00,"10-12 objects flying or moving symmetrically, moving south! All objects looked like stars! ((Starlink satellites?))",6/25/2020
4/30/2020 14:30,American Fork,UT,Changing,3 minutes,Stationary bright silver object hovering over mountain then vanished out of sight.,6/25/2020
4/30/2020 14:22,American Utah,UT,Light,3 minutes,Picture of the same UFO that they filmed at Skinwalker Ranch.,6/25/2020
4/30/2020 13:13,Cottonwood Heights,UT,,30 seconds,Hill AFB just did the Covid flyby to support our first responders. Took this picture on Ft. Union Blvd. looks like a foo fighter above.,5/7/2020
4/30/2020 11:30,San Diego,CA,Formation,5 minutes,Three objects in exact formation,6/25/2020
4/30/2020 9:17,Orlando,FL,Circle,3 minutes,There was circular lights flying in a straight line crossing the moon. ((Starlink satellites?)),6/25/2020
4/30/2020 9:17,Davie,FL,Light,3 minutes,Backyard UFO Fleet night sky sighting! ((Starlink satellites?)),6/25/2020
4/30/2020 9:14,Tifton,GA,Light,3 minutes,30+ dots of light flying ons behind the other in a straight line heading south east. ((Starlink satellites?)),6/25/2020
4/30/2020 3:28,Boise,ID,,,MADAR Node 111,6/25/2020
4/30/2020 3:15,Clearwater,FL,Other,30 minutes,Got up to 3:15am was attracted to look at a “star like” that suddenly went to a blinding bright envelope of bright light.,6/25/2020
4/30/2020 2:30,Bloomington,IL,Light,15 minutes,Spotted an indigo light to the east of the city. encounter lasted roughtly 15 minutes.,6/25/2020
4/30/2020 0:11,Pueblo,CO,,,MADAR Node 83,6/25/2020
4/30/2020 0:11,El Paso,TX,Unknown,10 seconds,"It was around 12:11 in the morning and I was just hanging out in my backyard with my dog. I saw an object flying very low, around 100 o",6/25/2020
4/30/2020,Pompano Beach,FL,Oval,10 minutes,I was looking to the West and all of a sudden by I think the planet Venus??? There was 12 lights flying parallel in a straight line for,6/25/2020
4/29/2020 23:55,Tulsa,OK,Circle,7seconds,Object appeared Southwest moving very very quick to the northeast. After the object made it a ways to the northeast it turn quite abrup,6/25/2020
4/29/2020 23:35,Banning,CA,Light,5 min,Driving down a dark road we spotted a helicopter chasing a light at high speeds,6/25/2020
4/29/2020 23:20,Citrus Heights,CA,Light,5 minutes,2 star objects appear then disappear while moving vertical into the sky.,6/25/2020
4/29/2020 23:00,Midland,TX,Sphere,10 minutes,Second sighting in 1 week. Strait line. Very high speed. Side observer also in sphere. Moving over 7.500 MPH. Saw by neighbor and us. S,6/25/2020
4/29/2020 22:30,Kelowna (Canada),BC,Cone,15 minutes,Space station like object looks like it’s continuously on a loop only seeing one object at a time 10 of them. ((Starlink satellites?)),6/25/2020
4/29/2020 22:00,Fort Jones,CA,Light,1-2 hours,"Multiple &quot;star&quot; like lights moving throughout night sky, then ascending into sky. ((Starlink satellites?))",6/25/2020
4/29/2020 22:00,Fort Jones,CA,Light,1-2 hours,First noticed a very bright light hovering in the sky. Then noticed some star like lights moving. ((Starlink satellites?)),6/25/2020
4/29/2020 22:00,Cape Coral,FL,Light,30 minutes,"Light moving sporadically over SW Florida coast. ((NUFORC Note: We suspect either Venus, or Sirius. PD))",6/25/2020
4/29/2020 21:40,Geneva,FL,Light,5 Minutes,We saw 50+ dots of light traveling in perfect unison one after the othe. ((Starlink satellites?)),6/25/2020
4/29/2020 21:40,Port Saint Lucie,FL,Oval,30 seconds,Several lights in a straight line and then disappearing above the stars. ((Starlink satellites?)),6/25/2020
4/29/2020 21:30,Woodbury,GA,Light,10 minutes,String of tiny lights in sky approx. 50 to 75 in single file straight line extremely high up. ((Starlink satellites?)),6/25/2020
4/29/2020 21:30,Salem,OR,Light,,My mom woke me up around 9:30 ish and told me to &quot;come look at this ufo hurry.&quot; Went outside and it looked like a super brigh,6/25/2020
4/29/2020 21:30,Vero Beach,FL,Light,10 minutes,While fishing on the Indian River near Johns island 30-40 lights were observed heading N to S. ((Starlink satellites?)),6/25/2020
4/29/2020 21:25,Los Angeles,CA,Fireball,10-15 seconds,"Bright, orange/reddish light spotted moving over East LA",6/25/2020
4/29/2020 21:25,Mount Pleasant,SC,Formation,20 seconds,We saw 6 lighted objects moving in a straight line towards a dimmer light and then disappeared.,6/25/2020
4/29/2020 21:15,Ponte Vedra Beach,FL,Light,5 minutes,Fleet of 30 crafts traveling in a row. ((Starlink satellites?)),6/25/2020
4/29/2020 21:00,Birmingham,AL,Circle,Night,About 20 Craftsin the sky moving at a fast rate in a single filed line. ((Starlink satellites??)),6/25/2020
4/29/2020 20:45,Richmond,TX,Diamond,2 minutes,i noticed a straight line of stars i thought then i noticed they were moving in perfect formation. ((Starlink satellites?)),6/25/2020
4/29/2020 20:40,Murfreesboro,TN,Formation,5 minutes,Straight line formation of 30 objects. ((Starlink satellites?)),6/25/2020
4/29/2020 20:35,Waynesboro,TN,Unknown,3 minutes,I saw a fast moving star light object and small sized object moving rapidly across the sky. ((Starlink satellites?)),6/25/2020
4/29/2020 19:18,Melbourne,FL,Light,4 minutes,Line of traveling white lights disappear one by one over Melbourne FL.,6/25/2020
4/29/2020 18:34,Fayetteville,AR,,,MADAR Node 136,6/25/2020
4/29/2020 16:45,Holt,FL,Rectangle,45 seconds,Witnessed oblong metallic object sit motionless in sky for 30 seconds before slowly flying away.,6/25/2020
4/29/2020 16:00,Tacoma,WA,Diamond,1 hour,See a whole fleet of UFO's all flying in a straight line. ((Starlink satellites?)),6/25/2020
4/29/2020 9:45,West Jordan,UT,Cylinder,30 minutes,I was walking northbound and observed a white light (much like Venus in brightness) slowly travelli g both and a very slowly speed. I g,6/25/2020
4/29/2020 4:15,Frostproof,FL,Light,3 seconds,I saw a very bright very green light descend over Lake Clinch.,6/25/2020
4/29/2020 3:18,Santa Fe,NM,,,MADAR Node 78,6/25/2020
4/29/2020 0:45,Carson City,NV,Sphere,20 minutes,Bright Object jumping back and forth in sky followed by 3 star like diagonally lined object hovering in the sky.,6/25/2020
4/29/2020 0:30,Ewa Beach,HI,Light,2 seconds,"White light, with orange trails on each side.",6/25/2020
4/28/2020 0:00,Hammonton,NJ,Formation,South Jersey,they travel very fast in single line in the sky traveling from the west. ((Starlink satellites?)),6/25/2020
4/28/2020 23:20,Trafalgar,IN,Circle,45 sec,Helicopter chasing red large round object in the sky.,6/25/2020
4/28/2020 23:15,Courtenay (Canada),BC,Light,15 minutes,"I watched them go by, they seem to be approximately the same distance apart. In a line. T ((Starlink satellites?))",6/25/2020
4/28/2020 23:00,Yerevan (Armenia),,Triangle,1 minute,"3 red dot lights keeping their triangle shape and spinning in circles, i saw this while i was smoking outside on my balcony,my apartmen",6/25/2020
4/28/2020 22:10,Wilmington,NC,Unknown,5 minutes,"10 white lights in formation, observed over Wilmington NC. ((Starlink satellites?))",6/25/2020
4/28/2020 22:00,Belton,SC,Circle,5 minutes,We saw (what I counted) 12 round orbs following one another at an exact distance from one another ((Starlink satellites??)),6/25/2020
4/28/2020 22:00,Millington,TN,Light,More than 30 minutes,"Bright singular light hovering, disappearing, then reappearing in minutes",6/25/2020
4/28/2020 22:00,Taylors,SC,Formation,5 minutes,String of lights formation. Traveling west to east. ((Starlink satellites?)),6/25/2020
4/28/2020 21:58,Iowa Park,TX,Light,4 minutes,It looked like a string of white lights evenly spaced apart. ((Starlink satellites?)),6/25/2020
4/28/2020 21:49,Kamay,TX,Light,1.5 minutes,I saw a line of about 8 to 10 star-like looking objects. They were moving in an upward angle towards south. ((Starlink satellites??),6/25/2020
4/28/2020 21:45,Iowa Park,TX,Formation,1.5 minutes,19 starry objects in a line vanish. ((Starlink satellites??),6/25/2020
4/28/2020 21:45,Lawton,OK,Formation,5 minutes,Linear light formation traveling east. ((Starlink satellites??),6/25/2020
4/28/2020 21:35,Leicester,NC,Formation,5 minutes,A string of fast moving lights moving rapidly from north to south. ((Starlink satellites??),6/25/2020
4/28/2020 21:30,Folly Beach,SC,Light,3 minutes,Approx. y 40 white lights in a straight line moving from right to left all disappearing at a certain point. ((Starlink satellites?)),6/25/2020
4/28/2020 21:30,Greensboro,NC,Formation,5 minutes,"23 unidentified flying objects in single file formation, flying at a high rate of speed. ((Starlink satellites?))",6/25/2020
4/28/2020 21:30,Richlands,NC,Light,15 minutes,lights evenly spaced traveling west to east. for aprox 15 min.. ((Starlink satellites??),6/25/2020
4/28/2020 21:30,Elkview,WV,Light,30 seconds,5-6 star like objects in a straight line moving across the sky from west to south east. ((Starlink satellites>)),6/25/2020
4/28/2020 21:30,Fordyce,AR,Light,5-10min,Lights traveling. ((Starlink satellites??),6/25/2020
4/28/2020 21:30,Louisville,KY,Light,5 MINUTES,Numerous lights moving in a single file seen in the nighttime sky. ((Starlink satellites?)),6/25/2020
4/28/2020 21:20,Wichita,KS,Formation,Minutes,Saw a bunch of round bright lights in formation across the whole sky..((Starlink satellites??),6/25/2020
4/28/2020 21:19,Charleston,WV,Light,About 2 minutes,Approximately 10 lights located high in the sky traveling simultaneously NW to SE. ((Starlink satellites?)),6/25/2020
4/28/2020 21:15,North Augusta,SC,Light,10 minutes,Long string of lights traveling for south west to the north east. Evenly spaced apart. ((Starlink satellites?)),6/25/2020
4/28/2020 21:15,Boiling Spring Lakes,NC,Other,90-120 seconds,"Numerous objects, similar in size and brightness to stars at night, moving rapidly in a northwest to southeast arc, then disappearing.",6/25/2020
4/28/2020 21:09,Watsonville,CA,,,MADAR Node 105,6/25/2020
4/28/2020 21:00,Mays Landing,NJ,Circle,20 seconds,30 silent bright lights moving fast in a row. ((Starlink satellites?)),6/25/2020
4/28/2020 21:00,Easley,SC,Light,18 minutes,50 light anomalies headed north east in PERFECT FORMATION AND SPACING apart. ((Starlink satellites??),6/25/2020
4/28/2020 21:00,Baltimore City,MD,Circle,10 seconds,Bright circular lights flying in unison. ((Starlink satellites?)),6/25/2020
4/28/2020 21:00,Merrilville,IN,Light,1:45,UFO’s Might be Observing Elon Musk’s StarLink satellites!,6/25/2020
4/28/2020 20:55,Scott’s Valley,CA,Chevron,5-10 seconds,"Large, dim, chevron shaped craft seen at night traveling north and accompanied by an oblong craft traveling very fast",6/25/2020
4/28/2020 20:51,Newark,DE,Light,1 minute,Lights moving evenly in single file at a fast pace. ((Starlink satellites?)),6/25/2020
4/28/2020 20:50,Pueblo,CO,Light,2-3 minutes,Traveling lights over Pueblo. ((Starlink satellites??),6/25/2020
4/28/2020 20:45,Medford,OR,Fireball,10 seconds,Flaming object traveling extremely quickly from east to west duration lasting between 3 and 8 seconds descended towards Jacksonville.,6/25/2020
4/28/2020 20:45,Beaverton,OR,Sphere,15 seconds,"Appeared out of nowhere, slighyly above the tree line, crossed over roadway, east to west. White ball of light, crossed quickly then sp",6/25/2020
4/28/2020 20:45,Cottonwood,AZ,Disk,5 seconds,"flew from East to West in straight line, flat circular object with dim white lights around edges. Seem to become brighter and then va",6/25/2020
4/28/2020 20:40,Salem,OR,Circle,2 minutes,"I was driving on Cordon Rd, from Ward Dr to State St when I saw it. It was going perpendicular of my driving. It was just below the clo",6/25/2020
4/28/2020 20:30,Albuquerque,NM,Light,2 minutes,UFO - Red light hovers over Sandia Mountain then at low it changes to two different colors and dissappears!!,6/25/2020
4/28/2020 20:30,Dixon,NM,Light,5min,"A string of lights symmetrical in distance apart, moving quick across the sky and then fading away. ((Starlink satellites?))",6/25/2020
4/28/2020 20:27,Tulsa,OK,Triangle,58 seconds,Photos of ufo hidden in cloud bank after thunderstorm.,6/25/2020
4/28/2020 20:26,Spencer,OK,Disk,30-45 seconds,"There was a single line of 13 saucer shaped disc headed east, there was no no noise. ((Starlink satellites??)",6/25/2020
4/28/2020 20:10,Palmer Lake,CO,Light,,There was a line of craft perfectly spaced traveling across the sky. ((Starlink satellites?)),6/25/2020
4/28/2020 20:00,Trinidad,CA,Disk,5 seconds,"Disk object seen flying at high rate of speed at low angle towards ocean. Surrounded by huge flames. Colored orange, yellow, blue, whit",6/25/2020
4/28/2020 20:00,Hope Mills,NC,Formation,20 Seconds,A perfectly straight line of bright lights were flying by overhead then ascended into outer space. ((Starlink satellites?)),6/25/2020
4/28/2020 18:00,Gresham,OR,Cigar,5 seconds,"Object was heading from east to west at an angle of descent. Was moving fast, unit it vanished. Entire object was lit up as a single li",6/25/2020
4/28/2020 16:00,Baker City,OR,Formation,45 minutes,I have never seen any thing like this and I use my binoculars several times a week.,6/25/2020
4/28/2020 15:00,Eugene,OR,Circle,Snap shot,4-28-20 3:10 pm I took three photos of a commercial plane flying East past our moon which was visible at the time. In the second photo,6/25/2020
4/28/2020 12:00,Magnolia Park,FL,Changing,11 minutes,Large white and green shape low in sky see in magnolia park fl,6/25/2020
4/28/2020 11:15,Denver,CO,Light,20 seconds,I was sitting outside viewing the norther sky when I noticed eight lights in the shape of the tip of an arrow ^ but facing downward. T,6/25/2020
4/28/2020 11:00,Granite Quarry,NC,Sphere,8-10 seconds,Driving south on hwy 52 in Granite Quarry NC. 11:00am looked to the left and noticed a round shiney object 2 miles away and a few miles,6/25/2020
4/28/2020 11:00,Lake Quivira,KS,Sphere,2 minutes,"During the morning we saw a UFO fly over us, black and transparent almost. It disappeared after a few minutes. Was weirdly shaped",6/25/2020
4/28/2020 10:59,Portland,OR,,,MADAR Node 66,6/25/2020
4/28/2020 10:50,Ontario,OR,Light,15 seconds,Satellite accelerated and changed directions around a seperate satellite very suddenly and quickly.,6/25/2020
4/28/2020 9:30,Wilson,NC,Light,10,20 lights flying single file evenly apart. ((Starlink satellites?)),6/25/2020
4/28/2020 9:30,Statesboro,GA,Fireball,5 mins,Several craft was shooting into the air and it lasted about 5 mins. It looked like a chain of lights. ((Starlink satellites?)),6/25/2020
4/28/2020 7:20,Selinsgrove,PA,Sphere,15 seconds,"Large Blue Sphere Over Susquehanna River, Selinsgrove PA, in the early morning hours of April 28, 2020",6/25/2020
4/28/2020 2:10,Hermitage,PA,Light,5 minutes,bright stationary star dims and brightens several times,6/25/2020
4/28/2020 0:10,Säve,,Triangle,00:10-00:27,prick vänder på himelen WTF.,6/25/2020
4/27/2020 23:30,Kent,WA,Circle,3-5 minutes,"Walked out side looking up at the night sky and thought to myself, wow there’s a lot of stars tonight. Well then I realized that one of",6/25/2020
4/27/2020 23:30,Maple Falls,WA,Unknown,15 minutes,Last night we were outside and saw an object moving across the sky. ((Starlink satellites?))o,6/25/2020
4/27/2020 23:00,Burnaby (Canada),BC,Light,one hour,Several star-like lights travelling across sky with one that sped up to avoid collision into another. ((Starlink satellites?)),6/25/2020
4/27/2020 23:00,Carmichael,CA,Light,30 seconds,It looked like the sheriffs helicopter with its spotlight on which is common in my area. Absolutely no no noise. It was flying direct,6/25/2020
4/27/2020 23:00,Fayetteville,GA,Egg,20 minutes,"Bright object over Atlanta, GA.",6/25/2020
4/27/2020 22:45,Carryville,TN,Formation,5 minutes,"I was driving home around 10:45 pm. I got off exit 134 in Carryville, Tn and over Covelake there were 3 orange lights. At first they we",6/25/2020
4/27/2020 22:40,Raymond,WA,Other,15-20 minutes,"24 lights from one spot in the sky, heading W S and E. ((Starlink satellites?))",6/25/2020
4/27/2020 22:00,Lansdale,PA,Cigar,25 minutes,UFO'S playing in the sky.,6/25/2020
4/27/2020 22:00,Marshfield,MO,Light,Apx. 10 minutes,Apx 22:00 went out and looked up and saw a line of lights moving in a straight line. ((Starlink satellites?)),6/25/2020
4/27/2020 22:00,Los Angeles,CA,Circle,1 hour,"It wasa Round Black Moon 45 degrees WNW with some yellow light coming through.

The more West it moved it started fading away.",6/25/2020
4/27/2020 21:30,Kansas City,KS,Formation,15 seconds,1 object with 6 lights or 6 smaller objects in a perfectly straight line moving West to east ((Starlink satellites?)),6/25/2020
4/27/2020 21:20,Jefferson City,MO,Light,5-7mins,A straight line of many multiple lights directly overhead. ((Starlink satellites?)),6/25/2020
4/27/2020 21:15,Chariton,IA,Light,3 minutes,Line of 30-40 white lights moving single file through the sky from NW to SE,6/25/2020
4/27/2020 21:15,Wentzville,MO,Circle,1 minute,30-50 lights flew from west to east in a straight line disappearing overhead. ((Starlink satellites?)),6/25/2020
4/27/2020 21:15,Chesterfield,MO,Formation,10 seconds,Star like formations moving quickly in sets of 3 across sky. ((Starlink satellites?)),6/25/2020
4/27/2020 21:14,Warsaw,MO,Other,5 min 2 times,Truman Dam Missouri string of lights. ((Starlink satellites?)),6/25/2020
4/27/2020 21:10,Brentwood,TN,Formation,2 minutes,little bright dots were lining up and heading to west and flying upwards and disappeared. ((Starlink satellites?)),6/25/2020
4/27/2020 21:10,Ruther Glen,VA,Unknown,18 seconds,"Large ufo in Ruther Glen, VA. ((Starlink satellites?))",6/25/2020
4/27/2020 21:09,Watsonville,CA,,,"MADAR Node 105, replaces 04/28/2020 same location",6/25/2020
4/27/2020 21:08,Townsend,DE,Formation,3 minutes,Lasted 3 minutes.right over my house 25 to 30 bright single and seperated by almost the same distance. ((Starlink satellites?)),6/25/2020
4/27/2020 21:06,Sunbury,PA,Circle,90 seconds,25 solid circular lights moving SE in a strait line. ((Starlink satellites?)),6/25/2020
4/27/2020 21:05,Kitty Hawk,NC,Formation,10 seconds,Observed straight line of 8-12 “moving stars on a very clear night. ((Starlink satellites?)),6/25/2020
4/27/2020 21:03,Ellicott City,MD,Formation,2 minutes,"A lined formation of brightly lit objects moving West to East, 12-15 objects in two groups, ((Starlink satellites?))",6/25/2020
4/27/2020 21:01,Buffalo,NY,Formation,2 minutes,"A long queue of whitish round orbs, perhaps 15 total, in the south covering the whole heavens. ((Starlink satellites?))",6/25/2020
4/27/2020 21:00,Wyomissing,PA,Unknown,>5 minutes,20 Lights in a row. ((Starlink satellites?)),6/25/2020
4/27/2020 21:00,Williamsburg,VA,Light,1 minute 30 seconds,40 plus lights detected in the sky traveling at a high rate of speed straight in a line. ((Starlink satellites?)),6/25/2020
4/27/2020 21:00,Chesapeake,VA,Other,10 seconds,Five lights (looked like stars) moving south one behind the other and disappeared in succession. ((Starlink satellites?)),6/25/2020
4/27/2020 21:00,Edwardsville,KS,Light,5 sec,Walked outside and seen a straight line of about 15 lights not in a row but two or three separated by a space. ((Starlink satellites?)),6/25/2020
4/27/2020 21:00,South Charleston,WV,Light,5min,Strand of lights perfectly spaced moving in unison across the sky. I counted over 20 crafts. ((Starlink satellites?)),6/25/2020
4/27/2020 21:00,North Potomac,MD,Light,2 minutes,In a clear sky 12-14 star like objects flying in a straight line from North towards South . ((Starlink satellites?)),6/25/2020
4/27/2020 21:00,Severn,MD,Circle,7 minutes,25-30 White Lights Flying Over Severn. ((Starlink satellites?)),6/25/2020
4/27/2020 20:50,Houston,TX,Circle,1-2 minutes,Circular object rotating and flying at a high rate of speed appeared to be avoiding my camera by turning off its lights.,6/25/2020
4/27/2020 20:45,Quratsite,AZ,Light,25 seconds,Flashing lghts inconsistent string blink bright to dim wavy flight patern ((Starlink satellites?)),6/25/2020
4/27/2020 20:40,Binghamton,NY,Light,5 to 10 minutes,About 10 to 15 white lights in a line seen in Upstate New York. ((Starlink satellites?)),6/25/2020
