Date / Time,City,State,Shape,Duration,Summary,Posted
4/14/2020 22:00,Marysville,MI,Triangle,30 seconds,"Triangle shaped object with three blinking yellow lights at points of the triangle. Thought to be a plane at first, but I noticed no no",6/25/2020
4/14/2020 21:15,Newport,OR,Circle,10 minutes,Very bright orb to the west over ocean. Was not the moon. Full moon on the 7th. Brighter than anything around. Below the white orb was,5/1/2020
4/14/2020 21:00,Las Vegas,NV,Light,,This object in the sky was to my right side it appeared to move and shine different lights around it,6/25/2020
4/14/2020 20:55,St Paul,MN,Light,35 minutes,Strream of lights moving with purpose to the northeast. ((Starlink satellites?)),6/25/2020
4/14/2020 20:35,Palm Springs,CA,Formation,3 minutes,"I’m in Palm Springs, California. I was sitting in my hot tube very sober just gazing at the stars. I pointed to the strange orange star",6/25/2020
4/14/2020 20:30,San Diego,CA,Triangle,5 seconds,"Triangle shaped UFO that was see through, holographic like that was very quiet, and flying really low.",6/25/2020
4/14/2020 20:00,Bathurst (Canada),NB,Light,0:04,Two objects flying south bound at very high speeds. One could have been a satellite but the other was much faster and veered south west,5/15/2020
4/14/2020 18:00,Santa Fe,NM,Light,20 minutes,me and my family saw evenly lights moving across sky in orderly fashion. ((Starlink satellites?)),6/25/2020
4/14/2020 16:30,Elephant Butte,NM,Other,2 hours,A fleet of crafts clearly seen over elephant butte nm golf course bidding in the clouds.,6/25/2020
4/14/2020 14:22,Jonesboro,AR,,,MADAR Node 143,6/25/2020
4/14/2020 13:35,Boise,ID,,,MADAR Node 111,6/25/2020
4/14/2020 12:16,Fayetteville,AR,,,MADAR Node 136,6/25/2020
4/14/2020 10:30,Tuscaloosa,AL,Unknown,20 minutes,I was sitting in my car playing poker on my phone when the reception went out. I got out of the car to move the phone around and a glow,6/25/2020
4/14/2020 10:11,Garrettsville,OH,,,MADAR Node 64,6/25/2020
4/14/2020 9:00,Muskogee,OK,Circle,15+,Tons of satellites. ((Starlink satellites?)),6/25/2020
4/14/2020 7:30,Fort Worth,TX,Disk,35 seconds,While amongst the homeless community in Fort Worth Texas. I decided to record and take pictures of the odd looking sky and clouds.,6/25/2020
4/14/2020 6:00,Las Cruces,NM,Light,10 minutes,20 lights moving from NW. to SE. In chain formation same path evenly spaced. ((Starlink satellites)),5/1/2020
4/14/2020 5:45,Alamogordo,NM,Unknown,15 minutes,Spotted 21 points of light flying in identical flightpath in ~45 second intervals. ((Starlink satellites?)),6/25/2020
4/14/2020 5:45,Las Cruces,NM,Formation,30 minutes,Long train of lights going over las vruces heading towards Mexico. Looked very high altitude. ((Starlink satellites?)),6/25/2020
4/14/2020 5:15,Thousand Oaks,CA,Light,5 minutes,"20+ circular white lights traveling in unison from N to S in predawn night sky, equally distanced. ((Starlink satellites?))",6/25/2020
4/14/2020 5:00,Nanaimo (Canada),BC,Light,10 minutes,A line of what appeared to be stars travelling from NW to SE above Nanaimo. ((Starlink satellites)),5/15/2020
4/14/2020 5:00,Vancouver,WA,Formation,,There were 10 bright white lights evenly spaced apart moving slowly across sky. There was no sound. ((Starlink satellites?)),6/25/2020
4/14/2020 5:00,Vancouver,WA,Formation,,There were 10 bright white lights evenly spaced apart moving slowly across sky. There was no sound. ((Starlink satellites)),5/15/2020
4/14/2020 5:00,Garrison,CO,Triangle,1 hour,At 4 am there was helicopters in the sky flying from west to east. My husband and I stood and watched as the helicopters Flying in a pa,7/23/2020
4/14/2020 5:00,Eugene,OR,Formation,10 minutes,I was like wow look at the stars and I see these orbs about two football fields apart there. ((Starlink satellites?)),6/25/2020
4/14/2020 5:00,Garrison,CO,Triangle,1 hour,At 4 am there was what we thought were helicopters in the sky flying from west to east. My husband and I watched a flight pattern of 3,7/23/2020
4/14/2020 4:50,Oroville,CA,Sphere,5 minutes,objects that looked like stars moving accross the morning sky. ((Starlink satellites?)),6/25/2020
4/14/2020 4:45,Central Point,OR,Circle,15 minutes,No less than 17 satellites all in a single line going from NW to SE. ((Starlink satellites?)),6/25/2020
4/14/2020 4:45,RIO VISTA,CA,Light,10,"Strange objects flying in perfect formation above Rio Vista, Ca ((Starlink satellites))",5/15/2020
4/14/2020 4:45,Indore City (India),,Unknown,5 seconds,Seen a bright spot travelling from west to east,6/25/2020
4/14/2020 4:35,Las Vegas,NV,Light,25 minutes,"2 Parades of satellites, 40 total, west to east across Las Vegas sky. ((Starlink satellites?))",6/25/2020
4/14/2020 4:35,Carson City,NV,Light,30 minutes,"Strange single file lights traveling from north to south at 4:35 to 5:20 Am over Carson city , NV. ((Starlink satellites?))",6/25/2020
4/14/2020 4:24,Northbrook,IL,,,MADAR Node 148,6/25/2020
4/14/2020 4:00,Montebello,CA,Light,4:00 to 5:00,Looked up at the sky and immediately noticed all the traffic high in the sky. ((Starlink satellites?)),6/25/2020
4/14/2020 4:00,Davis,CA,Light,1 hour,Hundreds of “satellite light” type craft heading inland to Nevada ((Starlink satellites?)),6/25/2020
4/14/2020 2:45,Powell River (Canada),BC,Light,10 minutes,"fast twinkling light hovering in night sky, colored red. (then poof gone after 10 minutes)",6/25/2020
4/14/2020 2:30,Kennebunk,ME,Light,20 minutes,Multiple lights following each other,6/25/2020
4/14/2020 2:30,Kennebunk,ME,Light,20 minutes,Multiple lights following each other ((Starlink satellites?)),6/25/2020
4/14/2020 2:16,Dover,NH,Changing,5 minutes,UFO accompanied by strange weather in Dover New Hampshire,6/25/2020
4/14/2020 0:00,Round Rock,TX,Sphere,5 seconds,Saw a white sphere hovering in front of my truck as I was driving and then disappeared.,5/15/2020
4/13/2020 23:30,Pensacola,FL,Unknown,2-3 minutes,"Craft was moving slowly to the east/SE and appeared to be less than 1,000 feet above me as I could see flames shooting out from underne",6/25/2020
4/13/2020 23:00,antalya,,Light,20 min,15 object going to west in sky.. 15 light only one formation.and very far.look its a star but not star. ((Starlink satellites)),5/7/2020
4/13/2020 23:00,Augusta,ME,,,5 orange lights following in formation but in a methodical way. All disappeared into a black part of space. ((Starlink satellites)),5/1/2020
4/13/2020 23:00,Brocket (Canada),AB,Circle,1 hour,"2 large oranges/white balls in sky. Red, blue, green lights swirling all around. It would stop and move up and down backwards .",6/25/2020
4/13/2020 22:45,Bangalore (India),,Formation,15 to 20 seconds,Flying Birds with lights sighted @ night moving in group in bangalore ((Starlink satellites?)),6/25/2020
4/13/2020 22:30,Flat Rock,NC,Light,5 minutes,I went outside to move my vehicle and noticed an odd bright light . At first I thought it was a plane waiting to land staying still for,6/25/2020
4/13/2020 22:30,Green Bay,WI,Light,20 minutes,"Bright light high in sky, not moving for awhile but moving down slowly and intermittently, different movement from planes we see here.",6/25/2020
4/13/2020 22:14,Modesto,CA,Sphere,1 minute,UFO cluster imaged from ISS.,6/25/2020
4/13/2020 22:00,Thousand Oaks,CA,Triangle,1 hour,"Very large seemingly floating.... multiple flashing lights, my pictures did not capture it, other than a bright light.",6/25/2020
4/13/2020 22:00,Tullahoma,TN,Circle,5 minutes,I was driving home when I saw a white object in the sky. At first I didn't think anything about it as helicopters fly in to our local h,6/25/2020
4/13/2020 22:00,Laie,HI,Disk,5 minutes,"Two bright red then orange golden dots/saucers in the sky, shining then dimming encircling each other until their lights went off.",6/25/2020
4/13/2020 22:00,Whitmire,SC,Light,8 minutes,Evenly Spaced Lights. ((Starlink satellites?)),6/25/2020
4/13/2020 21:50,Waterbury,CT,Sphere,45 minutez,"Twinkling red,blue,yellow,white light that stayed in the same general part of the sky moving in jerky movements from up down to left an",6/25/2020
4/13/2020 21:35,Powell,TN,Light,10 minutes,Line of lights. ((Starlink satellites?)),6/25/2020
4/13/2020 21:30,Jasper,GA,Sphere,30-45 minutes,At least 50 to 75 lights in single file formation moving from northwest to southeast. No sound. ((Starlink satellites?)),6/25/2020
4/13/2020 21:30,Tamassee,SC,Light,20 minutes,"20-30 bright lights, evenly spaced, flying in a row one behind the other, from NW to SE, no sound ((Starlink satellites?))",6/25/2020
4/13/2020 21:30,Asheville,NC,Formation,15,"Lineal pattern, sequential, star-like lights seen flying for 15 minutes in Asheville, NC. ((Starlink satellites?))",6/25/2020
4/13/2020 21:15,Phenix City,AL,Light,20 minutes or better,My husband and I watched over 100 balls of light flight over our home from the northqest towards the south east for more than 20 minute,6/25/2020
4/13/2020 21:00,Hartwell,GA,Light,30 minutes,"Saw a line of white lights that looked like stars moving in straight line, counted thirty eight objects. ((Starlink satellites?))",6/25/2020
4/13/2020 21:00,Montville,NJ,Circle,1 hour,Very bright light. Much larger than a star I took a picture and video. It appears to have a halo effect around it. ((Venus??)),6/25/2020
4/13/2020 21:00,West Islip,NY,Light,4,Fixed Light moved North to south very slowly.,6/25/2020
4/13/2020 21:00,Rossville,GA,Light,20 mins,"We were just sitting outside and noticed shooting stars, several, we counted around twenty. They were going in a strait line from Looko",6/25/2020
4/13/2020 21:00,Douglasville,GA,Light,20 minutes,lights racing across sky in same pattern,6/25/2020
4/13/2020 20:49,Newburgh,IN,,,MADAR Node 142,6/25/2020
4/13/2020 20:40,Ashland City,TN,Formation,5 minutes,"11, non-blinking lights, moving quickly in a single-file line across the sky. All equidistant and following ((Starlink satellites?))",6/25/2020
4/13/2020 20:30,Milton,FL,Light,10 minutes,15 or more white lights moving in single file formation from North to South. ((Starlink satellites?)),6/25/2020
4/13/2020 20:30,Nashville,TN,Light,10 min,We observed lights traveling in some formation following each other at a high rate of speed ((Starlink satellites?)),6/25/2020
4/13/2020 20:11,Rio Rico,,Formation,20 minutes,Series of lights identified in Santa Cruz County Arizona.,6/25/2020
4/13/2020 20:00,Lincolnton,GA,Light,,My grandparents saw about 30 ufos last night all in a line at the same distance apart. ((Starlink satellites?)),6/25/2020
4/13/2020 19:30,Neptune,NJ,Disk,>2 hours,"Bright light that hovered for hours, resembled a very bright star.",6/25/2020
4/13/2020 19:15,Tumwater,WA,Light,2 minutes,Illuminated Multicolored light formation with a vague white background,6/25/2020
4/13/2020 19:15,Franklin,TN,Other,7 minutes,"Llooking up at the stars last night, 6 of them began moving in straight lines, hundreds of miles in length. ((Starlink satellites?))",6/25/2020
4/13/2020 19:10,Gilbert,AZ,Sphere,10 minutes,"Bright white light changing to pulsing colors and then red moving at high speeds, eventually splitting into two objects.",6/25/2020
4/13/2020 15:55,Millerton,PA,,,MADAR Node 104,6/25/2020
4/13/2020 13:00,Burien,WA,Other,60 seconds,Looked out my deck toward shorewood beach and saw a black shaped boomerang come out of water with a man in a suit of some kind hovering,6/25/2020
4/13/2020 12:11,Newburgh,IN,,,MADAR Node 142,6/25/2020
4/13/2020 11:56,Wichita,KS,,,MADAR Node 123,6/25/2020
4/13/2020 5:55,Oakley,CA,Sphere,15 minutes,Multiple orbs witnessed flying in formation. ((Starlink satellites)),6/25/2020
4/13/2020 5:30,Central Point,OR,Light,20 min,unidentifiable lights in great numbers flying in a spaced out formation in the early morning sky. ((Starlink satellites?)),6/25/2020
4/13/2020 4:00,Tonopah,AZ,Light,5 minutes,"Small white, unblinking lights moving silently across sky.",5/1/2020
4/13/2020 3:31,SeaTac,WA,Light,10 minutes,Bright lights moving in a clockwise manner were observed at 3:30am,6/25/2020
4/13/2020,In Space (from the ISS),,Cigar,unknown,Pill like object seen from the ISS picture.,5/1/2020
4/12/2020 23:50,Elk River,MN,Light,approx 1 hour,Was driving home towards Elk River from St.Paul area around a quarter to 11pm.We are currently under &quot;Shelter in Place&quot; order,6/25/2020
4/12/2020 23:00,Danville,CA,Sphere,10 minutes,Large flashing yellow Orb Triangle.,6/25/2020
4/12/2020 23:00,Bandon,OR,Fireball,2 minutes,It was 10:00 at night and I Was walking to my tent and notice the stars wear out and looked at one that was glowing brighter then any s,6/25/2020
4/12/2020 22:35,Wellington,FL,Circle,6 seconds,3 big white lights on v shape formation heading south 190. No sound and you can see them through the clouds.,6/25/2020
4/12/2020 21:40,Montgomery,TX,Light,5 seconds,Blue orb emitted loud sound and disappeared in five seconds.,6/25/2020
4/12/2020 21:30,Universal City,TX,Sphere,15 minutes,"Three hovering, glowing orbs observed in sequence.",6/25/2020
4/12/2020 21:13,Emory,TX,Light,25,Objects that looked like a Satellite that moved in a straight line and disappear. About 35 + lights. ((Starlink satellites?)),6/25/2020
4/12/2020 21:00,North Bergen,NJ,Unknown,,snake shape bright light,6/25/2020
4/12/2020 21:00,Coronado,CA,Light,5 minutes,Two parallel lights (white) flashed red and white when I waved at the craft.,6/25/2020
4/12/2020 20:13,Las Vegas,NV,Fireball,2 minutes,Orb like fireballs,6/25/2020
4/12/2020 12:00,Montgomery,AL,Sphere,seconds,Fast moving soundless white sphere,6/25/2020
4/12/2020 11:26,Whately,MA,,,MADAR Node 67,6/25/2020
4/12/2020 11:14,Boise,ID,,,MADAR Node 111,6/25/2020
4/12/2020 9:38,Lad Cruces,NM,Circle,32 minutes,((Starlink satellites?)),6/25/2020
4/12/2020 7:07,Newington,CT,,,MADAR Node 106,6/25/2020
4/12/2020 6:34,Woodbine,GA,,,MADAR Node 154,6/25/2020
4/12/2020 5:33,Oregon City,OR,Light,at least 15 minutes,"East to West dozens,one after a other, lined up and at times multiples side to side, grid pattern. ((Starlink satellites?))",6/25/2020
4/12/2020 5:30,Graham,WA,Other,5-6 minutes,Taking dog outside. Looked up and saw a long line of single almost evenly spaced bright white lights moving across the sky. No sound. N,6/25/2020
4/12/2020 5:20,Ferndale,WA,Light,15 minutes,Line of lights (like satellites but many!) ((Starlink satellites?)),6/25/2020
4/12/2020 5:15,Longview,WA,Unknown,30 minutes,Long period of flashing lights traveling in a signle file line formation. ((Starlink satellites?)),6/25/2020
4/12/2020 5:00,Canby,OR,Formation,5:57,Fleet of 39+ Flying White Dot's. ((Starlink satellites?)),6/25/2020
4/12/2020 5:00,Surrey (Canada),BC,Circle,15 minutes,I noticed at first 3 lights flying above me at slow speed. Then i noticed 8 more behind them. ((Starlink satellites?)),6/25/2020
4/12/2020 5:00,Cloverdale,OR,Circle,30 minw,"50 Moving Lights over the ocean at Cape Kiwanda, OR. ((Starlink satellites?))",6/25/2020
4/12/2020 4:30,Eigene,OR,Formation,1 hr,4:30 AM I observed what I thought a satelite. I watched it cross the sky at satelite pace; traveling NW to SE. ((Starlink satellites?)),6/25/2020
4/12/2020 2:45,Oakley,UT,Light,30 seconds,Bright light shined in bedroom window illuminating the room removing shadows before shrinking to a single point and disappearing.,6/25/2020
4/12/2020 2:00,Miami,FL,Changing,30 secconds,Red-Orange fireball over Miami,6/25/2020
4/12/2020 1:00,Phoenix,AZ,Other,5-7 minutes,Star looking ufo in sky starts to move then dim out and get brighter,6/25/2020
4/11/2020 22:30,Perth Amboy,NJ,Light,30min,"The object was bright white at times stem like branches, object moved in various vertical and horizontal movements very slow.",6/25/2020
4/11/2020 22:15,Rincon,GA,Cylinder,1 minute,We saw 2 cylindrical objects move through the sky in an odd manner. It could not have been a plane or a comet.,6/25/2020
4/11/2020 22:00,Malden,MA,Circle,1 hour,I see and film rotating circular lights out through my window towards the South East horizon.,6/25/2020
4/11/2020 22:00,Wilmington,OH,Sphere,5-7 minutes,"Went outside to look at a plane flying over our area we had been tracking on a flight radar app, caught eye ((Starlink satellites?))",6/25/2020
4/11/2020 22:00,Ellington,CT,Light,5-10 minutes,30+ lights moving in formation moving across Ellington sky!,6/25/2020
4/11/2020 22:00,Oxford,OH,Light,15 min,Light moving. ((Starlink satellites?)),6/25/2020
4/11/2020 21:30,Kennewick,WA,Circle,5 seconds,Two objects chasing each other around night sky,5/7/2020
4/11/2020 21:20,Vancouver,WA,Unknown,multiple days,"Strange light above washington that doesn't move at all, ((NUFORC Note: Venus?? PD))",6/25/2020
4/11/2020 21:09,Quakertown,PA,Circle,54,Same as previous report second sighting of same object,6/25/2020
4/11/2020 21:05,Hanceville,AL,Light,5,"13 lights, straight trajectory, 30 sec apart, then disappeared. ((Starlink satellites?))",6/25/2020
4/11/2020 20:30,Ansonia,CT,Cigar,30min,"Sigle line formation one by one going towar the same directions, after zig zag formation. After desapear",6/25/2020
4/11/2020 20:28,Las Vegas,NV,Oval,Still happening,This is my 3rd report. It’s been in the sky for 5 days now and I’ve had no contact or confirmation from any of ur staff. I have binocul,6/25/2020
4/11/2020 20:25,Natick,MA,Light,5 minutes,16 lights (like stars) making a line flying over Natick Massachusetts ((Starlink satellites?)),6/25/2020
4/11/2020 20:15,Bourne,MA,Light,10 minutes,Series of lights moving west to east over cape cod. ((Starlink satellites?)),6/25/2020
4/11/2020 20:00,Junction City,OR,Sphere,45 minutes,"Looked metallic gray and was tilted at about a 45 degree angle, bottom visible. ((NUFORC Note: Possibly Sirius?? PD))",6/25/2020
4/11/2020 16:00,Medford,OR,Oval,30 minutes,"Pinkish reddish, shape was oval, hovered",6/25/2020
4/11/2020 13:09,Littlerock,CA,,,MADAR Node 56,6/25/2020
4/11/2020 10:04,Monroe township,NJ,Circle,3 hours,There was an inner red light with a larger outer blue light that was much taller,6/25/2020
4/11/2020 9:45,Spiceland,IN,Light,30 mins,Lights crossing the night sky one after another... Then disappearing. All in a straight line. ((Starlink satellites?)),6/25/2020
4/11/2020 9:15,Byron,NY,Light,2 minutes,Watch 1 object move drifrent directions at a speed that no air craft could possibly do.,6/25/2020
4/11/2020 1:30,SÃO PAULO (Brazil),,Light,30 MINUTES,Two vertical red lights in São Paulo city centre with explosive sound,6/25/2020
4/11/2020 0:58,Frackville,PA,Cigar,3-3 1/2,This was the best encounter.,6/25/2020
4/11/2020 0:30,Patterson,AR,Circle,3 minutes,"Saw five round crafts, six lights on bottom and one red light on center of bottom.",6/25/2020
4/11/2020 0:07,Woodland,CA,Circle,45-1hr,Ring camera caught object hovering and flying away.,6/25/2020
4/11/2020,,,,,Bright orange air craft flying in a V and then a t shape pattern as they joined up and flew quickly out of my range.,5/1/2020
4/10/2020 23:15,Pleasant City,OH,Light,>1 hour,Bright Stationary light seen that last for over an hour. ((Venus?)),6/25/2020
4/10/2020 23:00,Clifton Heights,PA,Light,30 minutes,Strange clusters of hovering white lights sometimes 3-5 of them seen nightly in the sky in Delaware County PA,6/25/2020
4/10/2020 22:50,Vukovar (Croatia),,Light,2 minutes,"10.4.2020 I went smoke outside then I saw light on the sky above Vukovar. At first light had weak shine and it was moving, when it reac",5/7/2020
4/10/2020 22:20,Portland,,Light,90 seconds,"2 lights (white with slight amber pulses) moving swiftly, turning suddenly and sharp. In sw sky in Portland Oregon",5/15/2020
4/10/2020 22:15,Clifton park,NY,Circle,2 hours,Bright circle hovering over Clifton park. ((NUFORC Note: Possibly Venus?? PD)),6/25/2020
4/10/2020 22:00,Rocky Hill,CT,Circle,45 min,"noticed large circular object in sky at 22:00 hrs was stationary. round, spikes with white lights around bottom. upper part like two",6/25/2020
4/10/2020 22:00,rocky hill,CT,Circle,45 min,"noticed large circular object in sky at 22:00 hrs was stationary. round, spikes with white lights around bottom.",5/15/2020
4/10/2020 22:00,Reading,PA,Circle,1.5 hours,"Tonight I saw a bright light or cluster of bright lights hover for over an hour silently at about 2,000 feet above the city below our m",6/25/2020
4/10/2020 22:00,Toronto (Canada),ON,Light,15 min,Saw multiple (15) lights following eachother on the same trajectory. ((Starlink satellites)),6/25/2020
4/10/2020 21:38,Bend,OR,Unknown,30 min,"I've never been a believer, but maybe… ((Starlink satellites))",6/25/2020
4/10/2020 21:35,Twentynine Palms,CA,Light,5 mins,"About 10mi southeast of Marine base, two lights(UFO) slowly alternating red, green. White lights were coming down like spot lights. No",6/25/2020
4/10/2020 21:30,Mayflower,AR,Light,30 min,There were a string of disappearing lights. ((Starlink satellites)),5/15/2020
4/10/2020 21:30,Madison,CT,Light,5 minutes,"multiple repeated lights like aircraft or satellites on same pathway, ((Starlink satellites))",6/25/2020
4/10/2020 21:30,London (Canada),ON,Circle,15 minutes,They followed in formation. ((Starlink satellites)),5/15/2020
4/10/2020 21:30,madison,CT,Light,5 minutes,multiple repeated lights like aircraft or satellites on same pathway. ((Star;oml satellites)),5/7/2020
4/10/2020 21:30,Stockbridge,MA,Light,five miniutes,Fifteen lights seen at same time. ((Starlink satellites?)),6/25/2020
4/10/2020 21:20,Bellwood,PA,Light,10 min,line of lights in sky over central pennsylvania ((Star;oml satellites)),5/7/2020
4/10/2020 21:15,Hamilton (Canada),ON,Light,10 minutes,Convoy traveling across the sky. ((Starlink satellites)),6/25/2020
4/10/2020 21:15,Ashburn,VA,Light,15 minutes,"many small bright dots flying in a line with a same distance from each other, disappearing isame location. ((Starlink satellites))",6/25/2020
4/10/2020 21:00,Shady Side,MD,Light,20 minutes,20 bright light Objects traveling high in the sky then disappearing in the handle of the Big Dipper. ((Starlink satellites)),6/25/2020
4/10/2020 21:00,Cardiff,CA,Sphere,3 hours,There were 3 glowing objects in the sky bouncing around for about 3 hours.,5/15/2020
4/10/2020 21:00,Watervliet,NY,Circle,20 minutes,Several flying objects observed in Albany county,6/25/2020
4/10/2020 21:00,Norwalk,CT,Unknown,40 minutes,Yellow orange lights moving in the sky of Connecticut USA,6/25/2020
4/10/2020 10:15,Dubach,LA,Light,3 minutes,I saw a string of lights in the sky with a bright light pulsing down the line fly from 100ft away to over horizon in seconds.,6/25/2020
4/10/2020 9:00,Silver Spring,MD,Oval,20 minutes,My friend and I watch them for about 20 minutes. they would go across the sky and uniform spacing. ((Starlink satellites?)),6/25/2020
4/10/2020 6:32,St. Louis,MO,,,MADAR Node 70,6/25/2020
4/10/2020 6:30,Pflugerville,TX,Triangle,5 minutes,"Large craft lights made it appear triangular, with a opening another craft entered the opening and closed, then was gone.",5/7/2020
4/10/2020 6:05,Stanwood,WA,Light,9 mins,20 plus dots of light moving rapidly south In the early morning before dawn sky. ((Starlink satellites)),5/7/2020
4/10/2020 5:45,Seattle,WA,Circle,2 minutes,"It was a clear early morning. Saw Jupiter, Mars and Saturn in the South East. ((Starlink satellites))",5/7/2020
4/10/2020 5:30,Arlington,WA,Light,20 minutes,14 bright lights flying in trail. ((Starlink satellites)),5/7/2020
4/10/2020 1:20,Louisville,KY,Light,30 seconds,No structure just a silent ball of light.,6/25/2020
4/10/2020 0:00,Langenfeld (Germany),,Other,20 minutes,"At around 22:21 I saw a light in the shape of like a star,, however I thought plain at first but then it zig zagd ((Venus??))",5/7/2020
4/10/2020 0:00,Boaz,AL,Other,>30 minutes,"These Orbs had Green lights and White blinking lights.They moved and hovered!They were at approx 30,000 feet high moving from East to W",5/1/2020
4/10/2020,Indian Rocks Beach,FL,Light,1 hour,Watched a light hover way above night sky that swayed and dimmed in and out many times. Too high for a drone and longer than a drone wo,6/25/2020
4/9/2020 22:45,Temple,NH,Light,15 minutes,"I was looking out the window, towards Pack Monadnock mountain, and I saw a bright light low, thru the trees. I had my lower strength g",5/7/2020
4/9/2020 22:44,bronx,NY,Light,20 Minutes,A star like bright object in the sky that did not move for 20 minuets,5/7/2020
4/9/2020 22:30,Hartford,CT,Light,30 minutes,"It was a clear night in April, around 10:30PM. I saw a bright white “star like” thing in the sky. It was NOT moving.",6/25/2020
4/9/2020 21:45,Helena,MT,Formation,15 minutes,"I saw the ISS then looked further west and noticed four lights, about the intensity of stars, moving N to S. ((Starlink satellites))",5/7/2020
4/9/2020 21:25,Emmetsburg,IA,Other,20 seconds,Two lights at even distance,5/7/2020
4/9/2020 21:20,Waterloo,IA,Light,15 minutes,While looking towards North sky spotted small starlike light moving from west to east. ((Starlink satellites)),5/7/2020
4/9/2020 21:15,Auora,IL,Light,20 minutes,28 in line lights evacuating from Orion's Belt. ((Starlink satellites)),5/7/2020
4/9/2020 21:11,Lake Mills,WI,Other,2 hours,Spacecraft Working Venus,6/25/2020
4/9/2020 21:00,Canton,OH,Circle,1-2 hrs,Two bright orbs in sky. Flickering lights. No movement or sound . ((Venus??)),5/7/2020
4/9/2020 21:00,Buenos Aires (Argentina),,Cross,2 / 3 minutes,Winged cylinder-shaped like a cross in the dark night no lights,5/7/2020
4/9/2020 21:00,Davenport,WA,Circle,0.3,Bright target shaped object over “lake Rosevelt”,6/25/2020
4/9/2020 21:00,Rochester,MN,Rectangle,20 minutes,Brilliant white light. ((Venus)),5/7/2020
4/9/2020 20:50,Portland,OR,Light,20 seconds,A light. Moved in a non known manner,5/7/2020
4/9/2020 20:50,Roseville,CA,Light,10 min,Me & my GF seen the lights in sky 8 of them there was no light beam shinning from ground ((Starlink satellites)),5/7/2020
