datetime,city,state,country,shape,duration_seconds,duration_hours_min,comments,date_posted,latitude,longitude 
6/15/1967 20:00,arbuckle,ca,us,triangle,240,3-4 mins.,At dusk in 1966 or 67 three lights in formation or triangular craft with no visible substance floated silently into the West.,4/27/2007,39.0175,-122.0566667
6/15/1967 20:30,salt lake city,ut,us,disk,120,1or2 min.,In June of 1967 while waiting in our car to get into a drive-in movie a saucer shaped craft hovered between us and the Wasatch Mountain,1/28/1999,40.7608333,-111.8902778
6/15/1967 22:00,lake magog (canada),qc,,disk,45,45 seconds,Fast moving white object zig-zags across lake stops beside tree top (orange saucer) for a short time then shoots into sky.,4/18/2014,45.173563,-72.149922
6/15/1967 22:00,savannah,ga,us,chevron,240,3-4 minutes,Five orange glowing spheres together in a line above the treetops.,7/16/2003,32.0833333,-81.1
6/15/1968 1:00,utapao rtafb (thailand),,,formation,1200,20 minutes,Multiple lights in formation appearing on a horizontal line in the NNW sky,4/16/2005,12.680084,101.006255
6/15/1968 2:00,panama city,fl,us,light,900,2:00-0215,A large circular bright light appeared abruptly and stationaryfor 10 to 20 minutes in front of the USS Vigor(MSO-473) at two in the mo,6/3/2010,30.1586111,-85.6602778
6/15/1968 3:00,greensboro (while driving on the turnpike in wv),nc,us,triangle,120,2 minutes,Electric blue long tail kite  floating over W. Va. Turnpike seen over Greensboro NC at almost same hour,11/28/2007,36.0725,-79.7922222
6/15/1968 15:00,akron,oh,us,disk,180,3 minutes,Disk in the City,2/18/2001,41.0813889,-81.5191667
6/15/1968 15:00,canoga park,ca,us,cylinder,600,10 min,Observed a very long shiny object over the San Fernando Valley in or around 1968.,5/27/2003,34.2011111,-118.5972222
6/15/1968 17:00,baytown,tx,us,cigar,7200,2 +hours,In support of sightings 7/15/66 &amp; 6/15/68 in Galveston &amp; Pasadena Texas,2/14/2006,29.7352778,-94.9772222
6/15/1968 17:00,bishop,ca,us,disk,1800,30 min.?,Bright light several thousand feet over the Owens Valley near Bishop California.  Attacked by airplanes and left at high speed,4/1/2000,37.3636111,-118.3941667
6/15/1968 17:00,louisville,ky,us,unknown,1200,20 minutes,Unknown light/object moving perpendicular/horizontal in seconds and disappearing then reappearing,5/15/2006,38.2541667,-85.7594444
6/15/1968 17:00,oak cliff,tx,us,disk,1200,20 minutes,Disk with lighted windows hovers near apartment complex as we stood in parking lot and watched.,12/2/2013,32.7391667,-96.8108333
6/15/1968 17:00,oak cliff,tx,us,disk,2700,45 minutes +,Hovering disk with oval portholes in daylight hrs for a long time,1/5/2011,32.7391667,-96.8108333
6/15/1968 17:00,pasadena,tx,us,cigar,120,2 min,Cigar shaped UFO with it&#39s tailend on fire,2/22/2002,29.6908333,-95.2088889
6/15/1968 20:00,allentown,pa,us,sphere,300,5 minutes,Craft and Crew sighted,7/5/2008,40.6083333,-75.4905556
6/15/1968 20:00,pittsburgh,pa,us,light,1800,30 minutes,Bright object observed hovering over a radar site by pilots Air Force officers and tower personnel.,9/2/2005,40.4405556,-79.9961111
6/15/1968 20:30,wytheville,va,us,disk,600,10 min,the domed saucer had lights around the dome and hovered close to the ground-with a loud humming noise.,6/12/2008,36.9483333,-81.085
6/15/1968 21:00,brevard,nc,us,circle,300,5 minutes,4 people saw this same orangeglowingsilentenergy mass fly right by us......,7/1/2002,35.2333333,-82.7344444
6/15/1968 22:00,mariposa,ca,us,unknown,600,10 min.,Red lights shined into the back of the car.. just like the police have.,3/16/2012,37.485,-119.9652778
6/15/1968 22:00,mojave desert,ca,,light,2,few seconds,It was a summer night. I had gone camping with my dog to a mountain elevation (Placerita Canyon)north of LA. The stars were very bright,5/11/2005,35.93181,-116.227858
6/15/1968 22:30,garden valley,ca,us,disk,15,15 seconds,06-1968  Late evening forested  foothill road saucer  100 ft above car  3 witnesses  no recall for 8 years.,2/21/2014,38.8541667,-120.8583333
6/15/1969 6:00,islip,ny,us,other,1200,20 minutes,Sightings/Multiple witnesses,3/31/2008,40.7297222,-73.2108333
6/15/1969 7:00,grang junction colorado,co,,disk,120,2 minutes,Me and brother were walking to the book store on main street and we heard a whistle sound coming from above . We looked up there and sa,11/11/2013,39.063871,-108.550649
6/15/1969 15:00,little rock,ar,us,cylinder,60,1 minute,no sound or lights,6/10/2003,34.7463889,-92.2894444
6/15/1969 19:00,altoona,pa,us,other,600,10 minutes,Space ship hovered with colored lights going around not flashing just circling the ship,5/29/2011,40.5186111,-78.395
6/15/1969 20:00,bryan,tx,us,triangle,60,1 min,the lights of the first craft turned back on and 2 more identically lighted aircraft zipped in on both sides of the lead aircraft ...,7/5/2005,30.6741667,-96.3697222
6/15/1969 23:50,fairfax,va,us,oval,60,1 minute,Huge blimp-like craft; lights around the middle of craft; no sound; hovering above the highway.,11/2/1999,38.8461111,-77.3066667
6/16/1956 13:00,cincinnati,oh,us,disk,1200,six hours,glass likeyou could see threwcraft was 20 feet in front of meas i stepped closer a ramp out of the side of the craft opened up and,4/13/2010,39.1619444,-84.4569444
6/16/1962 23:30,joyce,wa,us,other,180,3 minutes,Three minutes over Crescent Beach WA,10/30/2006,48.1366667,-123.7327778
6/17/1955 7:00,rantoul,il,us,light,600,10 minutes,We had fallen out to the parking lot awaiting marching orders to go to (chow) it was still dark and we saw a light approaching from the,8/5/2001,40.3083333,-88.1558333
6/17/1961 19:00,chicago,il,us,disk,300,5 min,Disk shapped saucer over the city of Chicago.,10/31/2003,41.85,-87.65
6/18/1960 23:00,chicago,il,us,oval,3,3  seconds,AS I LYE IN THE NIGHT MY EYES FOCUSED ON HEAVEN FIVE DISCS SILENTLY PASSED OVER SOMETIME ROUND ELEVEN. THESE OVAL SHAPED OBJECTS GAVE,3/2/2004,41.85,-87.65
6/18/1966 11:00,duluth,mn,us,disk,900,15 min,Intell at Winnepeg disembark and debreif all passangers from a NW  727 after a close encounter over Lake Superior.,8/1/2003,46.7833333,-92.1063889
6/18/1966 21:30,newington,ct,us,triangle,300,4-5 minutes,Sighting of UFO near the Connecticut Light &amp; Power Bldg. Newington CT,3/13/2012,41.6977778,-72.7241667
6/19/1957 21:00,san leandro,ca,us,light,90,1.5 minutes or so,The night of Sputnik a drag race in the sky of 5+ objects stole the show for us.,4/16/2005,37.725,-122.155
6/19/1964 20:00,tucson,az,us,triangle,10,10 sec,Early 60&#39s Triangle Craft,9/17/2003,32.2216667,-110.9258333
6/19/1965 0:00,western pacific,,,unknown,120,1-2 minutes,high speed ufo spotted and tracked on U.S. Navy radar,4/16/2005,38.482702,-90.761284
6/20/1961 0:00,webster groves,mo,us,circle,120,minutes,webster groves mo ciecular craft with a light searching the ground fifty years ago,2/14/2010,38.5925,-90.3572222
6/20/1965 2:00,albuquerque,nm,us,disk,300,5 minutes,Traveling in a pick up truck we saw a bright glowing green disk fly over us.  It made the engine &amp; electrical of the truck stop immedi,5/24/1999,35.0844444,-106.6505556
6/20/1966 17:00,greenhills,oh,us,disk,600,10 minutes,I stood under a flying saucer spotted in daylight at 40 foot distance... WILD&#33&#33&#33,8/12/2008,39.2680556,-84.5230556
6/20/1966 21:00,huntington,in,us,disk,600,10 minutes,Saucer shaped object,12/23/2002,40.8830556,-85.4975
6/20/1967 18:00,fairfield,ca,us,cigar,60,1 minute,I believe,6/20/2005,38.2494444,-122.0388889
6/20/1968 7:00,salt lake city,ut,us,light,3,3 secs,Utah U F O,3/11/2006,40.7608333,-111.8902778
6/20/1968 15:00,fairfield,ia,us,other,300,5 minutes,Huge object 100&#39-150&#39appearing like a chrome coated deflated balloon moved slowly over Fairfield Iowa,8/5/2001,41.0086111,-91.9625
6/20/1968 19:00,york,pa,us,egg,10,5-10 seconds,Egg shaped object lit-up like the moon.,5/15/2006,39.9625,-76.7280556
6/20/1968 22:00,badlands,sd,,unknown,90,1 min 30 sec,On clear night two objects make large circle in the sky and disappear at very high speed.,1/17/2004,43.85538,-102.339691
6/21/1957 19:30,norwalk,ca,us,disk,480,8 minutes,It was hovering about 20 feet from the ground and hovered for about 8 minutes.,7/15/2005,33.9022222,-118.0808333
6/21/1960 14:00,east bernstadt,ky,us,disk,90,90 seconds,The disc was about 30 feet across and moved silently; I was a five year old child. I was terrified and ran inside.,3/19/2009,37.1894444,-84.1177778
6/21/1966 21:45,little axe,ok,us,light,300,5 minutes,Extreme level flight instant stophover rapid disappearence,8/5/2012,35.2325,-97.2122222
6/21/1968 20:30,upper lisle,ny,us,triangle,120,1-2 minutes,Silent slow moving huge dark grey triangular craft with 3 lights in each corner.,1/10/2014,42.3961111,-75.9575
6/21/1969 23:00,ronkonkoma,ny,us,unknown,3600,1 hour,A unidentified craft with multi-colored lights that hovered silently and could move at Incredible speeds,10/11/2005,40.8152778,-73.1127778
6/23/1955 7:00,beach haven park,nj,us,disk,60,1 minute,3 women hanging clothes saw a UFO come down over bay hover for 30 sec.then take off so fast it seemed to disappear.,1/28/1999,39.5975,-74.2130556
6/23/1959 22:00,minneapolis,mn,us,formation,7200,2 hrs,Flying while in the Marine Corps in a AD Skuraider &amp; with a wing man at apprx 6000 ft observed Four Red cly objects estimating at 20,1/17/2004,44.98,-93.2636111
6/23/1967 22:30,boise,id,us,light,120,2 minutes,Light landing on runway traveling past end zone travelling overland over roadless area then turning to merge into freeway traffice,6/18/2004,43.6136111,-116.2025
6/24/1956 14:00,madera,ca,us,sphere,120,2 minutes,Half spherical object with portholes on the side.  Mid 1950&#39s in Central California.  Day time.,7/4/2012,36.9613889,-120.0597222
6/25/1962 2:00,ossining,ny,us,unknown,900,10-15 min,refueling in summer 62 ossining ny,1/17/2004,41.1627778,-73.8619444
6/25/1965 13:00,portland,or,us,disk,120,2 minutes,The object  was stationary.,4/16/2005,45.5236111,-122.675
6/25/1965 15:00,philadelphia,pa,us,cigar,600,10 minutes,A cylinder shaped vessel decended then hovered. It was the size of a bus but larger in diameter. The craft had no wings windows tail,10/2/1999,39.9522222,-75.1641667
6/25/1966 21:30,rapid city (ellsworth afb),sd,us,disk,600,several hours,UFOs visited our Minuteman ICBMS during the summer of 1966 and I was there.,4/27/2004,44.0805556,-103.2305556
6/25/1966 21:30,rapid city (ellsworth afb),sd,us,unknown,345600,2-4 days,I KNOW THIS INCIDENT HAPPENED AND I BELIEVE HE IS TELLING IT THE WAY HE KNOW&#39S IT.,10/30/2006,44.0805556,-103.2305556
6/25/1967 13:00,none,mi,,disk,2,2 seconds,daylight disk at 200 meters.,10/8/2007,45.48657,9.253152
6/25/1968 11:00,honolulu,hi,us,circle,480,8 minutes,it was a night that was extremly dark my friend mark and I were playing army and I rolled under neith a parked car and rolled back o,4/16/2005,21.3069444,-157.8583333
6/25/1969 0:00,moline,il,us,unknown,900,15 minutes,True Storys of UFO&#39S 1968 LIGHT &amp; 2ND STORY UFO WAS DULL SILVER IN COLOR IN 1977 19781979,10/25/2011,41.5066667,-90.515
6/26/1963 23:40,naha (japan),,,circle,180,3 minutes,Stealth flying craft were not developed until many years later.,8/12/2008,26.212312,127.679157
6/26/1968 13:00,wyoming,mn,us,disk,60,1min,I sent this in the other day tothe national reporting site as well....My brothers and I and other friends have saw ufo&#39s in the area ov,9/4/2003,45.3363889,-92.9969444
6/27/1967 23:00,glendale,az,us,light,600,10 minutes,Glendale AZ 11:00 Pm white sphere silently appeared in sky It moved to 12 &quot; in front of my face flew off.,1/17/2004,33.5386111,-112.1852778
6/28/1959 13:00,globe,az,us,rectangle,300,5 minutes,Rectangular shape consisting of what resembled plumbing joints connecting the four sides together hovered above us and shot straight up,9/2/2005,33.3941667,-110.7858333
6/28/1964 21:00,alexandria,va,us,disk,600,10 minutes,1965 or 64  Chestnut Pl Alex VA  dusk saucer like with spinning top like red/blue/green bottom of object.,7/3/2013,38.8047222,-77.0472222
6/28/1968 21:00,cottonwood,az,us,circle,2700,45 mn.,It was dusk and still very warm so my family and I went out on our porch to cool off. The porch faced west toward Mingus Mountain we,1/28/1999,34.7391667,-112.0091667
6/29/1964 21:50,atlanta,ga,us,changing,900,15 minutes,UFO over  drive-in theatre.,5/12/2009,33.7488889,-84.3880556
6/29/1968 1:00,thurmont,md,us,disk,3600,1 hour,I&#39ve been visited many times but I can&#39t remember anything  other than they mean us no harm.,11/8/2005,39.6236111,-77.4111111
6/30/1955 0:00,quartz hill,ca,us,disk,2,seconds,childhood ufo,7/5/2008,34.6452778,-118.2172222
6/30/1955 13:00,lubbock,tx,us,cigar,120,2 minutes,Cigar shaped cloud and left very fast.,11/28/2007,33.5777778,-101.8547222
6/30/1955 21:00,dumas,tx,us,light,600,10 minutes,1955 - Air Force jets pursue lights over small Texas community.,4/16/2005,35.8655556,-101.9727778
6/30/1955 21:00,morehead city,nc,us,disk,300,5 minutes,Mid 1950&#39s Saucer in North Carolina Multiple Witnesses.,4/11/2014,34.7227778,-76.7263889
6/30/1956 1:00,willow grove,pa,us,light,7200,2 hrs.,Willow Grove Naval Air Station PA.,4/16/2005,40.1438889,-75.1161111
6/30/1956 13:00,cape girardeau,mo,us,diamond,300,5 minutew,Angular UFO sighted as a child,12/12/2011,37.3058333,-89.5180556
6/30/1956 16:00,new brunswick,nj,us,disk,600,approx. 10 minutes,Four Saucers over the City of New Brunswick NJ in the summer of 1956,4/17/2008,40.4861111,-74.4522222
6/30/1956 18:30,houston,tx,us,triangle,900,10-15 minutes,,2/21/2014,29.7630556,-95.3630556
6/30/1957 3:30,birmingham,mi,us,unknown,300,5 minutes,Grey alien drills into my back when I was a child in the 1950&#39s,7/3/2013,42.5466667,-83.2113889
6/30/1957 12:00,new york city,ny,us,teardrop,600,i0min,glowing lights lead the way,2/14/2006,40.7141667,-74.0063889
6/30/1957 13:00,burlington,ia,us,circle,90,90 seconds,Slow travel when observed followed by an abrupt direction change with unbelievable acceleration.,6/2/2013,40.8075,-91.1127778
6/30/1957 18:00,russellville,ar,us,sphere,600,10 minutes,Huge orange ball floating over Russellville Arkansas in late 50s.,4/12/2013,35.2783333,-93.1336111
6/30/1957 20:00,barker,ny,us,disk,180,3 minutes,1957  Four miles south of Barker NY 6 kids 1 adult saw saucer at dusk 2 kids saw it again in daylight next day,5/15/2013,43.33,-78.555
6/30/1957 21:00,albany,ca,us,circle,60,around 1 minute&#44 estimate,What looked like a moving star and a stationary star seemed to collide whereupon the stationary star also began to move.,8/30/2013,37.8869444,-122.2966667
6/30/1958 12:00,silverdale,wa,us,cylinder,32400,8-9 hours,Cylindrical craft hovered above the house with blinking lights of multiple colors for a long duration of time.,1/31/2011,47.6447222,-122.6936111
6/30/1958 13:00,conyers,ga,us,teardrop,300,5 min.,Sighting of a UFO ca. 1958.,5/2/2011,33.6675,-84.0177778
6/30/1958 16:00,camden (penobscot bay),me,us,disk,2,seconds?,Mother and pre-teen son witness a silver disc crash into Penobscot Bay.,7/16/2006,44.2097222,-69.0652778
6/30/1958 21:30,durham,ks,us,light,2,several seconds,1950&#39s  Durham KS  evening  after dark 2 bright lights going across southern sky for several seconds,4/18/2012,38.4861111,-97.2277778
6/30/1958 23:00,thibodaux,la,us,fireball,90,90 seconds,Historical Sighting  I have related this many times but never committed it to writing until now. I was motivated to write this by the,1/21/2008,29.7955556,-90.8227778
6/30/1959 2:30,north atlanticocean,,,unknown,1800,30 min,unidentified radar contact over Atlantic Ocean,11/21/2010,35.746512,-39.462891
6/30/1959 14:00,campbellsport,wi,us,circle,1200,20 min,I was a radar operator at Fallon NAS we were a parasite unit of the air force. We got a call from the Navy control tower to check out,6/12/2008,43.5977778,-88.2788889
6/30/1959 20:00,new york city (bronx),ny,us,oval,1200,approx. 1/2 hr.,My husband and I didn&#39t believe in UFO&#39s until we actually saw one&#33,7/19/2010,40.7141667,-74.0063889
6/30/1959 21:00,phoenix,az,us,disk,60,<1 minute,1959 Saucer shaped object sighting Phoenix Arizona,6/23/2010,33.4483333,-112.0733333
6/30/1960 12:00,litchfield,pa,us,other,600,10 muntes?,When I was around 10 years old I was going to where my dad was baling hay on top a hill.My brother Glenn was with me and when we ca,11/28/2007,41.9675,-76.4305556
6/30/1961 8:00,greensboro,nc,us,cigar,10,10 seconds,Silver cigar craft came out of the woods,3/13/2012,36.0725,-79.7922222
6/30/1961 15:00,orlando,fl,us,disk,300,5 minutes,Orlando sighting in early 1960&#39s midday group of children and parents at a birthday party.,2/14/2010,28.5380556,-81.3794444
6/30/1961 19:00,la mirada,ca,us,cigar,172800,several days,Everyone in my family remembers the nightly sightings of 5 orange cigar shaped objects that appeared in the sky over several days in th,10/30/2006,33.9172222,-118.0111111
6/30/1961 22:00,rotan,tx,us,sphere,1800,25 to 30 minutes,large beeping orb with lighted spires,5/2/2011,32.8519444,-100.4652778
6/30/1962 2:00,granada hills,ca,us,sphere,5,4-5 seconds,Ping-pong size floating ball observed through window in San Fernando Valley 1962,1/5/2011,34.2647222,-118.5222222
6/30/1962 7:00,cadiz,ca,us,unknown,10,10 seconds,We saw a silver brushed sillhoutte about the size of a person floating about 1-2 ft above the ground with no features of any sort.,12/12/2011,34.52,-115.5119444
6/30/1962 17:30,royal oak,mi,us,disk,600,5-10 min,Ship over Royal Oak early 60s,5/29/2011,42.4894444,-83.1447222
6/30/1962 18:00,bethpage,ny,us,triangle,300,5 minutes,While I was a young boy playing in my dads belair around 1962 or 1963. I saw multiple bright white lights traveling west to east about,7/4/2012,40.7441667,-73.4825
6/30/1962 19:00,bay area,ca,,disk,300,1/2 hour,Large saucer shaped craft hovering California 1962,1/5/2011,37.714145,-122.25
6/30/1963 0:00,johnstown,pa,us,rectangle,300,3 to 5 minutes,very large stealth shaped as big as a football field. dome  on bottom that rotated. an the dome was iluminated,3/19/2009,40.3266667,-78.9222222
6/30/1963 6:00,newark,tx,us,disk,120,1 or 2 min.,30 someodd years later and I finally saw proof of my early morning sighting,12/7/2006,33.0011111,-97.4841667
6/30/1963 13:00,salt lake city,ut,us,disk,120,2 min,SAUCER5 SHAPED AND SILVER,10/30/2006,40.7608333,-111.8902778
6/30/1963 14:00,anaheim,ca,us,disk,1200,20 min +,First sighting 1963 disk shaped 50 foot diameter no noise and was stable when stopped over my head.,4/18/2012,33.8352778,-117.9136111
6/30/1963 15:00,canada,,,triangle,60,less than 1 min,Silent black triangle flew over our car in 1963.,3/18/2014,56.130366,-106.346771
6/30/1963 21:00,coventry (uk/england),,gb,circle,15,15 seconds,Very close encounter which has changed my views on alien life forever.,10/8/2007,52.416667,-1.55
6/30/1964 1:00,ontonagon,mi,us,rectangle,180,3 minutes,Large rectangular shape heading up River St. to Lake Superior.,2/4/2013,46.8711111,-89.3138889
6/30/1964 14:00,hoquiam,wa,us,other,300,5 minutes?,I was about five or six years old I was on my way down a primitive road to play baseball with the rest of the kids out in the field t,5/3/2000,46.9811111,-123.8880556
6/30/1964 21:30,lewistown,il,us,other,120,several minutes,Not a craft but a humanoid being that emanated light...,9/2/2005,40.3930556,-90.1547222
6/30/1965 0:00,colville,wa,us,flash,30,30 seconds,Bright as day in the middle of the night.,7/5/2008,48.5466667,-117.9044444
6/30/1965 14:00,mount shasta,ca,us,cigar,1800,30 minutes +,Metallic cigar shaped object windowless soundless motionless unlighted daytime/clear blue sky sighting over old Drive-in movie the,1/28/1999,41.31,-122.3094444
6/30/1965 15:00,ocala,fl,us,cigar,3600,1 hour,Abductioin observed by Sherif Deaputy and myself,3/4/2008,29.1869444,-82.1402778
6/30/1965 19:00,elkins,ar,us,disk,600,10 minutes,On a clear night you could see the saucer,8/5/2009,36.0013889,-94.0080556
6/30/1965 20:00,chesapeake (norfork area),va,us,egg,20,15-20 sec,lookng out bedroom window saw object going by aprox distance 1500ft away and about1000ft high speed about 400-600mph. whole object woul,1/11/2002,36.8188889,-76.2752778
6/30/1965 21:00,blasdell,ny,us,oval,30,30 seconds,It was a summer night. While I was walking going into my house I looked up above my neighbors house about 30 feet above the roof. And,3/13/2012,42.7972222,-78.8236111
6/30/1965 22:00,otisville (near),ny,us,unknown,30,hour,Light extending to ground than back to central area than qutckly moving from one section of sky to another,2/1/2007,41.4733333,-74.5388889
6/30/1965 23:00,fountain valley,ca,us,sphere,300,5 minutes,Round orange object with a tail traveling down from the that stopped in midair and hovered then disappeared toward the east,3/19/2009,33.7091667,-117.9527778
6/30/1966 0:00,manor,pa,us,oval,5,5 seconds,Bright light drifts past window and lights up whole room.,4/18/2012,40.6325,-78.9838889
6/30/1966 0:01,new mexico,nm,,disk,900,15 minutes,followed for about 15 minutes by saucer like object  which disappeared at low level across desert in New Mexico in 1966.,2/14/2006,34.51994,-105.87009
6/30/1966 1:00,germany (enroute to france),,,light,30,30 seconds,While on leave in the US Army we rented a car and was in route to Paris; enroute we witnessed a &quot;meteor&quot; descent then ascend.,5/12/2009,51.165691,10.451526
6/30/1966 1:00,mendota,ca,us,disk,300,5 minutes or more,Disc shaped in 1966. Stopped my parents&#39 car.,12/12/2011,36.7536111,-120.3805556
6/30/1966 5:00,new york city (bronx),ny,us,circle,10,5-10 seconds,Orb or throgsneck bridge.,1/30/2014,40.7141667,-74.0063889
6/30/1966 10:00,washington,in,us,circle,30,30 seconds,Small spinning circular shaped object passes between houses but doesn&#39t come down.,6/9/2009,38.6591667,-87.1727778
6/30/1966 14:00,montague,ca,us,other,600,5-10 minutes,Fast moving star object over Montague CA.,1/10/2014,41.7283333,-122.5266667
6/30/1966 15:00,jonesboro,ar,us,disk,120,minutes,Clear day a disk shape with rotating multi colored lights silently hovering over trees in the back yard.,3/18/2014,35.8422222,-90.7041667
6/30/1966 15:00,portage la prairie (canada),mb,ca,disk,600,about 10 minutes,I was a non-believer in UFOs. However after being a witness to a sighting count me as a believer&#33,4/16/2005,49.966667,-98.3
6/30/1966 16:00,corning,ca,us,disk,300,5 minutes,2 small (2 ft)  &amp; 1 large saucers seen at close range by multiple witnesses Northern CA about 1966,2/1/2007,39.9277778,-122.1780556
6/30/1966 17:00,wayne,pa,us,cigar,30,half-minute or less,Rocket-like UFO Seen Flying Over Suburban Philadelphia In Summer of 1966,4/16/2005,40.0438889,-75.3880556
6/30/1966 21:00,blocksburg,ca,us,disk,600,10 min,?,3/19/2009,40.2761111,-123.6352778
6/30/1966 21:00,spartanburg,sc,us,light,900,15 min,Summer of 1966 - bright orange round object first thought to be rising full moon,6/2/1998,34.9494444,-81.9322222
6/30/1966 22:30,santa fe,nm,us,disk,300,5 minutes,three eyewitness&#39s and picture in news paper of ufo,1/31/2011,35.6869444,-105.9372222
6/30/1966 23:00,auburn,ca,us,other,300,5 minutes,Craft was low to the ground and stopped at witnesses.,8/30/2013,38.8966667,-121.0758333
6/30/1966 23:00,winston-salem,nc,us,other,1200,20 minutes,Football shaped objects with lights hoovers in neighborhood and streaks of with great bursts of speed and returns.,10/10/2011,36.0997222,-80.2444444
6/30/1967 3:00,lander,wy,us,light,600,5 - 10 minutes,They were just lights but very curious lights at that.,5/4/2004,42.8330556,-108.73
6/30/1967 3:00,oakwood (dayton),oh,us,circle,180,3 minutes,In the forty years since I have yet to see anything that will explain away what I witnessed in the middle of the night.,8/27/2009,39.7252778,-84.1741667
6/30/1967 9:00,goleta,ca,us,unknown,10800,3 hours,Chased by Grays in Santa Barbara in 1967,2/14/2008,34.4358333,-119.8266667
6/30/1967 19:00,portmouth,ri,,disk,300,5 mins,Luminous disc shaped tilted object with aura/haze around it,10/30/2006,41.602324,-71.250326
6/30/1967 20:00,slidell,la,us,circle,60,about 1 minute,I appreciate this forum to report what I saw. I was a young lad who went outside to feed the dog in the back yard. While walking back t,3/11/2006,30.275,-89.7811111
6/30/1967 21:00,lansing,ks,us,light,300,5 mins,Silent light darts to avoid collision.,4/17/2008,39.2486111,-94.9
6/30/1967 21:00,schofield barracks,hi,,circle,8,5 to 8 sec.,Luminescent disk traveling at fantastic speed over ocean near Schofield barracks Hawaii,8/7/2007,21.495496,-158.062655
6/30/1967 21:30,aiken,sc,us,oval,180,3 minutes,Strange oval shaped silent metallic object about 2000 feet ovrehead with four oscillating lights,12/9/2003,33.5602778,-81.7197222
6/30/1967 22:00,glenview,il,us,circle,900,15 minutes +,Large ball of light hovering above the road in Glenview Illinois - 25 - 30 observers - 1967 or 1968.,3/19/2009,42.0697222,-87.7877778
6/30/1967 22:00,new market,al,us,triangle,60,1 minute,Discs in V-formation flying over Northern Alabama in the summer of 1967,8/5/2009,34.91,-86.4277778
6/30/1968 1:00,whittier,ca,us,sphere,420,7 minutes?,A sphere of blue/white light/energy descended from the night sky to just outside my window.  It was 8-10&quot; and brissling with an electri,11/21/2010,33.9791667,-118.0319444
6/30/1968 9:00,hueytown,al,us,oval,600,10 min,Almond colored disc four witnesses saw beings in vehicle.,3/13/2012,33.4511111,-86.9966667
6/30/1968 10:00,auburn,ma,us,other,720,12 minutes,UFO sighting outside of window hovering 25 feet away,10/30/2012,42.1944444,-71.8361111
6/30/1968 11:00,ponca city,ok,us,light,300,5 minutes,Fast moving red &#39dot&#39 in the night sky suddenly made a sharp right angle turn and flew into space.,3/19/2009,36.7069444,-97.0852778
6/30/1968 12:00,gardendale,al,us,disk,6,5-6 seconds,daylight sighting of flying disk in late 1960s in North Central Alabama,7/16/2006,33.66,-86.8127778
